{
  "schema_version": "1.0.0",
  "receipt_id": "rcpt_a1b2c3d4e5f60718",
  "decision_id": "dec_01J6G7R8Q9ABCDEFGHJKMNPQ50",
  "experiment_id": "exp_01J6G7R8Q9ABCDEFGHJKMNPQ20",
  "correlation_id": "corr_01J6G7R8Q9ABCDEFGHJKMNPQ02",
  "public_decision": "SWITCH",
  "internal_outcome": "SWITCH_RECOMMENDED",
  "baseline_configuration_id": "cfg_948a3f81e3a1b029",
  "candidate_configuration_id": "cfg_4f1b82d3e9a0c784",
  "task_segment_id": "swe_coding_python_interactive",
  "baseline_aggregate_id": "agg_12345678abcdef01",
  "candidate_aggregate_id": "agg_87654321fedcba10",
  "canary_id": "cnry_01J6G7R8Q9ABCDEFGHJKMNPQ60",
  "why_decision": "Candidate configuration with 2048 thinking tokens resolved 3/4 tasks (75% pass rate) with acceptable latency ($0.004833 CPR), passing all canary guardrails.",
  "why_not_cheapest": "Cheapest candidate (Flash with 0 thinking) failed the quality floor (pass rate 25% < 75%).",
  "what_would_reverse_it": "A detected regression in canary latency exceeding 5000ms or price increase above $2.50/M tokens.",
  "known_limitations": [
    "Evaluated on a 4-task judged SWE-bench cohort only.",
    "Single repetition per task in current sweep."
  ],
  "truth_class": "BENCHPRESS_MEASURED",
  "evidence_hash": "e4e4e4e4e4e4e4e4e4e4e4e4e4e4e4e4e4e4e4e4e4e4e4e4e4e4e4e4e4e4e4e4",
  "code_commit_sha": "f5f5f5f5f5f5f5f5f5f5f5f5f5f5f5f5f5f5f5f5",
  "created_at": "2026-08-29T10:00:50.000Z"
}
